{
  "test_timestamp": "2025-12-04T14:34:50.074961+00:00",
  "foreman_version": "1.0.0",
  "overall_status": "PASS",
  "subsystems": [
    {
      "subsystem_name": "Core Governance System",
      "status": "PASS",
      "details": "All 8 files validated successfully",
      "files_checked": 8,
      "files_passed": 8,
      "files_failed": 0,
      "missing_files": [],
      "invalid_files": [],
      "risks": [],
      "recommended_actions": []
    },
    {
      "subsystem_name": "Architecture System",
      "status": "PASS",
      "details": "All 8 files validated successfully. Index contains 12 modules",
      "files_checked": 8,
      "files_passed": 8,
      "files_failed": 0,
      "missing_files": [],
      "invalid_files": [],
      "risks": [],
      "recommended_actions": []
    },
    {
      "subsystem_name": "Builder Agent System",
      "status": "PASS",
      "details": "All 10 files validated successfully",
      "files_checked": 10,
      "files_passed": 10,
      "files_failed": 0,
      "missing_files": [],
      "invalid_files": [],
      "risks": [],
      "recommended_actions": []
    },
    {
      "subsystem_name": "Compliance Engine",
      "status": "PASS",
      "details": "All 5 files validated successfully",
      "files_checked": 5,
      "files_passed": 5,
      "files_failed": 0,
      "missing_files": [],
      "invalid_files": [],
      "risks": [],
      "recommended_actions": []
    },
    {
      "subsystem_name": "QA & QA-of-QA System",
      "status": "PASS",
      "details": "All 6 files validated successfully",
      "files_checked": 6,
      "files_passed": 6,
      "files_failed": 0,
      "missing_files": [],
      "invalid_files": [],
      "risks": [],
      "recommended_actions": []
    },
    {
      "subsystem_name": "Runtime & Continuity System",
      "status": "PASS",
      "details": "All 12 files validated successfully",
      "files_checked": 12,
      "files_passed": 12,
      "files_failed": 0,
      "missing_files": [],
      "invalid_files": [],
      "risks": [],
      "recommended_actions": []
    },
    {
      "subsystem_name": "Change Management System",
      "status": "PASS",
      "details": "All 9 files validated successfully. Found 12 change records",
      "files_checked": 9,
      "files_passed": 9,
      "files_failed": 0,
      "missing_files": [],
      "invalid_files": [],
      "risks": [],
      "recommended_actions": []
    },
    {
      "subsystem_name": "Upgrade & Continuity System",
      "status": "PASS",
      "details": "All 4 files validated successfully",
      "files_checked": 4,
      "files_passed": 4,
      "files_failed": 0,
      "missing_files": [],
      "invalid_files": [],
      "risks": [],
      "recommended_actions": []
    },
    {
      "subsystem_name": "Test Environment System",
      "status": "PASS",
      "details": "All 4 files validated successfully",
      "files_checked": 4,
      "files_passed": 4,
      "files_failed": 0,
      "missing_files": [],
      "invalid_files": [],
      "risks": [],
      "recommended_actions": []
    },
    {
      "subsystem_name": "Orchestration & Build Pipeline",
      "status": "PASS",
      "details": "All 6 files validated successfully",
      "files_checked": 6,
      "files_passed": 6,
      "files_failed": 0,
      "missing_files": [],
      "invalid_files": [],
      "risks": [],
      "recommended_actions": []
    },
    {
      "subsystem_name": "Platform & UI Standards",
      "status": "PASS",
      "details": "All 6 files validated successfully",
      "files_checked": 6,
      "files_passed": 6,
      "files_failed": 0,
      "missing_files": [],
      "invalid_files": [],
      "risks": [],
      "recommended_actions": []
    },
    {
      "subsystem_name": "Innovation & Admin Intelligence",
      "status": "PASS",
      "details": "All 3 files validated successfully",
      "files_checked": 3,
      "files_passed": 3,
      "files_failed": 0,
      "missing_files": [],
      "invalid_files": [],
      "risks": [],
      "recommended_actions": []
    }
  ],
  "summary": {
    "total_subsystems": 12,
    "passed": 12,
    "warnings": 0,
    "failed": 0,
    "total_files_checked": 81,
    "missing_files_count": 0,
    "invalid_json_count": 0
  },
  "recommendations": [],
  "change_records": [
    {
      "cr_id": "CR-BW1-008-POLICY_BUILDER-Architecture-Gaps",
      "module": "unknown",
      "status": "OPEN"
    },
    {
      "cr_id": "CR-BW1-004-THREAT-Architecture-Gaps",
      "module": "unknown",
      "status": "OPEN"
    },
    {
      "cr_id": "CR-BW1-011-SKILLS_DEVELOPMENT_PORTAL-Architecture-Gaps",
      "module": "unknown",
      "status": "OPEN"
    },
    {
      "cr_id": "CR-BW1-003-RISK_ASSESSMENT-Architecture-Gaps",
      "module": "unknown",
      "status": "OPEN"
    },
    {
      "cr_id": "CR-BW1-005-VULNERABILITY-Architecture-Gaps",
      "module": "unknown",
      "status": "OPEN"
    }
  ],
  "builder_readiness": {
    "ui_builder": "NOT_READY",
    "api_builder": "NOT_READY",
    "schema_builder": "NOT_READY",
    "integration_builder": "NOT_READY",
    "qa_builder": "NOT_READY"
  },
  "compliance_coverage": {
    "iso_27001": false,
    "nist_csf": true,
    "cobit": true,
    "owasp": true
  },
  "runtime_readiness": {
    "memory_spine_valid": true,
    "environment_map_valid": true,
    "export_script_exists": true
  }
}